[
  {
    "schema_version": "1.0",
    "finding_id": "M-01",
    "reviewer_role": "review_method",
    "issue_type": "future_information",
    "severity": "major",
    "confidence": "high",
    "verification_status": "verified",
    "source_location": "L15-L15",
    "claim_or_observation": "Forecast evaluation uses a future observation not available at decision time.",
    "evidence_location": [
      {
        "schema_version": "1.0",
        "artifact": {
          "schema_version": "1.0",
          "path": "runs/doublecheck-review-v01/inputs/manuscript.md",
          "sha256": "2f50d187c8ee773538941fa6c1b16b21ccd038bdd852cc5f388b4dbc41df68c9"
        },
        "description": "Decision time and reported forecast input",
        "locator": "L15-L15"
      }
    ],
    "reasoning": "The description explicitly establishes the availability order.",
    "impact": "The evaluation does not establish feasible real-time performance.",
    "recommended_action": "Re-evaluate using only information available when a task is selected.",
    "additional_material_required": [
      "Original experiment protocol and logs"
    ],
    "verification_method": "Synthetic review record prepared for adjudication testing; inspect the cited manuscript lines and any calculation evidence.",
    "verification_limitations": "Only supplied synthetic material; not a real experiment or an assessment of actual investigators."
  },
  {
    "schema_version": "1.0",
    "finding_id": "M-02",
    "reviewer_role": "review_method",
    "issue_type": "split_details",
    "severity": "minor",
    "confidence": "medium",
    "verification_status": "insufficient_information",
    "source_location": "L17-L17",
    "claim_or_observation": "The training and test split protocol is not supplied.",
    "evidence_location": [
      {
        "schema_version": "1.0",
        "artifact": {
          "schema_version": "1.0",
          "path": "runs/doublecheck-review-v01/inputs/manuscript.md",
          "sha256": "2f50d187c8ee773538941fa6c1b16b21ccd038bdd852cc5f388b4dbc41df68c9"
        },
        "description": "Split reporting limitation",
        "locator": "L17-L17"
      }
    ],
    "reasoning": "Absence of the protocol does not establish that no split was performed.",
    "impact": "Temporal separation cannot be assessed from the supplied materials.",
    "recommended_action": "Request the split protocol and verify it if supplied.",
    "additional_material_required": [
      "Original experiment protocol and logs"
    ],
    "verification_method": "Synthetic review record prepared for adjudication testing; inspect the cited manuscript lines and any calculation evidence.",
    "verification_limitations": "Only supplied synthetic material; not a real experiment or an assessment of actual investigators."
  }
]
